{
  "$schema": "http://json-schema.org/draft-07/schema#",
  "$id": "https://wondertwin.dev/schemas/twin-manifest.schema.json",
  "$version": "1.0",
  "title": "Twin Contribution Manifest",
  "description": "Schema for twin contribution manifests describing a twin's capabilities and coverage.",
  "type": "object",
  "required": [
    "tier",
    "publisher",
    "vendor",
    "twin_id",
    "display_name",
    "category",
    "sdk_target",
    "service_surface",
    "coverage",
    "generation",
    "vendor_certification"
  ],
  "properties": {
    "tier": {
      "type": "string",
      "description": "Distribution tier for the twin. Describes provenance and licensing, not pricing. 'community' = MIT licensed, public repo, no account needed. 'commercial' = BSL licensed, pro repo, account required. Pattern is permissive for forward-compat with future tiers (enterprise, hosted) per twin-naming-design \u00a73.3.",
      "pattern": "^[a-z]+$"
    },
    "publisher": {
      "type": "string",
      "description": "Identity that authored and ships the twin. 'localstack' is the first-party publisher; 'wondertwin' is the legacy first-party value still present on unmigrated manifests; third-party publishers use their own kebab-case identifier.",
      "pattern": "^[a-z][a-z0-9-]*$"
    },
    "vendor": {
      "type": "string",
      "description": "Vendor's identity in the world (e.g. 'stripe', 'modern-treasury'). Lowercase, no prefix, kebab-case for multi-word vendors. Renamed from the previous 'twin' field per twin-naming-design.",
      "pattern": "^[a-z][a-z0-9-]*$"
    },
    "twin_id": {
      "type": "string",
      "description": "Directory/binary identity within a tier+publisher scope. MUST equal 'twin-' + vendor.",
      "pattern": "^twin-[a-z][a-z0-9-]*$"
    },
    "display_name": {
      "type": "string",
      "description": "Human-readable display name for the twin."
    },
    "vendor_domain": {
      "type": "string",
      "description": "Canonical brand domain for the vendor (e.g., \"stripe.com\", \"linear.app\"). Used by downstream tooling for logo rendering and brand identity. Pick the canonical brand site, not the corporate parent.",
      "pattern": "^[a-z0-9][a-z0-9.-]*\\.[a-z]{2,}$"
    },
    "version": {
      "type": "string",
      "description": "Twin's own semver version. Source of truth for the binary's Version (embedded via go:embed per twin-versioning-design \u00a73.1).",
      "pattern": "^\\d+\\.\\d+\\.\\d+(?:[-+][0-9A-Za-z.-]+)?$"
    },
    "compatible_versions": {
      "type": "array",
      "description": "Semver ranges this twin self-declares as wire-compatible across releases of itself. Consumed by `wt install` and license entitlement matching (twin-versioning-design \u00a73.2).",
      "items": {
        "type": "string"
      },
      "minItems": 1
    },
    "vendor_api_version": {
      "type": [
        "string",
        "null"
      ],
      "description": "Vendor API surface this twin claims to faithfully simulate (e.g. \"2024-10-15\" for Stripe). Vendor-specific format. Null if the vendor doesn't version its API or the twin tracks latest. Per twin-versioning-design \u00a73.2."
    },
    "vendor_certification": {
      "type": "object",
      "description": "Whether the vendor has officially certified the twin. Required on every manifest; may be {\"status\": \"none\"}. Per twin-versioning-design \u00a73.2.",
      "required": [
        "status"
      ],
      "properties": {
        "status": {
          "type": "string",
          "enum": [
            "certified",
            "pending",
            "none"
          ]
        },
        "certified_by": {
          "type": "string"
        },
        "certified_at": {
          "type": "string",
          "format": "date-time"
        },
        "certificate_url": {
          "type": "string",
          "format": "uri"
        },
        "valid_until": {
          "type": "string",
          "format": "date-time"
        }
      },
      "allOf": [
        {
          "if": {
            "properties": {
              "status": {
                "const": "certified"
              }
            },
            "required": [
              "status"
            ]
          },
          "then": {
            "required": [
              "status",
              "certified_by",
              "certified_at",
              "certificate_url",
              "valid_until"
            ]
          }
        },
        {
          "if": {
            "properties": {
              "status": {
                "const": "pending"
              }
            },
            "required": [
              "status"
            ]
          },
          "then": {
            "required": [
              "status",
              "certified_by",
              "certified_at"
            ]
          }
        }
      ],
      "additionalProperties": false
    },
    "released_at": {
      "type": "string",
      "format": "date-time",
      "description": "Timestamp this twin version was released."
    },
    "category": {
      "type": "string",
      "description": "Category of the service the twin emulates."
    },
    "description": {
      "type": "string",
      "description": "Brief description of what the twin does."
    },
    "sdk_target": {
      "type": "object",
      "description": "SDK targeting information.",
      "required": [
        "primary"
      ],
      "properties": {
        "primary": {
          "type": "object",
          "description": "Primary SDK target.",
          "required": [
            "package",
            "language",
            "version",
            "repo_url"
          ],
          "properties": {
            "package": {
              "type": "string",
              "description": "SDK package name."
            },
            "language": {
              "type": "string",
              "description": "Programming language."
            },
            "version": {
              "type": "string",
              "description": "SDK version."
            },
            "repo_url": {
              "type": "string",
              "description": "Repository URL for the SDK."
            },
            "docs_url": {
              "type": "string",
              "description": "Documentation URL for the SDK."
            },
            "api_version": {
              "type": "string",
              "description": "Version of the upstream API targeted."
            }
          },
          "additionalProperties": false
        },
        "additional": {
          "type": "array",
          "description": "Additional SDK targets with compatibility status.",
          "items": {
            "type": "object",
            "required": [
              "package",
              "language"
            ],
            "properties": {
              "package": {
                "type": "string",
                "description": "SDK package name."
              },
              "language": {
                "type": "string",
                "description": "Programming language."
              },
              "version": {
                "type": "string",
                "description": "SDK version tested against."
              },
              "repo_url": {
                "type": "string",
                "description": "Repository URL for the SDK."
              },
              "docs_url": {
                "type": "string",
                "description": "Documentation URL for the SDK."
              },
              "compatibility": {
                "type": "string",
                "description": "Compatibility confidence level.",
                "enum": [
                  "tested",
                  "inferred",
                  "untested"
                ]
              },
              "last_validated": {
                "type": "string",
                "format": "date",
                "description": "Date when compatibility was last validated."
              },
              "validation_method": {
                "type": "string",
                "description": "How compatibility was validated.",
                "enum": [
                  "scenario_suite",
                  "manual",
                  "none"
                ]
              },
              "known_gaps": {
                "type": "array",
                "description": "Known behavioral differences from the primary SDK.",
                "items": {
                  "type": "string"
                }
              }
            },
            "additionalProperties": false
          }
        }
      },
      "additionalProperties": false
    },
    "service_surface": {
      "type": "object",
      "description": "Description of the service surface the twin emulates.",
      "properties": {
        "openapi_spec": {
          "type": "object",
          "description": "OpenAPI specification availability.",
          "properties": {
            "available": {
              "type": "boolean",
              "description": "Whether an OpenAPI spec is available."
            },
            "origin": {
              "type": "string",
              "description": "Origin of the OpenAPI spec."
            },
            "url": {
              "type": "string",
              "description": "URL of the OpenAPI spec."
            }
          },
          "additionalProperties": false
        },
        "auth_pattern": {
          "type": "string",
          "description": "Authentication pattern used by the service.",
          "enum": [
            "api_key",
            "oauth2",
            "basic",
            "jwt",
            "custom",
            "none"
          ]
        },
        "has_webhooks": {
          "type": "boolean",
          "description": "Whether the service supports webhooks."
        },
        "resource_count": {
          "type": "integer",
          "description": "Number of SDK resources covered."
        }
      },
      "additionalProperties": false
    },
    "coverage": {
      "type": "object",
      "description": "Coverage information for the twin.",
      "properties": {
        "resources_implemented": {
          "type": "array",
          "description": "List of implemented SDK resources.",
          "items": {
            "type": "string"
          }
        },
        "resources_not_implemented": {
          "type": "array",
          "description": "List of SDK resources not yet implemented.",
          "items": {
            "type": "string"
          }
        },
        "estimated_coverage_pct": {
          "type": "integer",
          "description": "Estimated percentage of SDK coverage.",
          "minimum": 0,
          "maximum": 100
        }
      },
      "required": [
        "resources_implemented"
      ],
      "additionalProperties": false
    },
    "generation": {
      "type": "object",
      "description": "How the twin was generated.",
      "required": [
        "method"
      ],
      "properties": {
        "method": {
          "type": "string",
          "description": "Generation method used.",
          "enum": [
            "wondertwin_skill",
            "manual",
            "other"
          ]
        },
        "skill_version": {
          "type": "string",
          "description": "Version of the WonderTwin skill used."
        },
        "sources_used": {
          "type": "object",
          "description": "Which sources were used during generation.",
          "properties": {
            "deepwiki": {
              "type": "boolean",
              "description": "Whether DeepWiki was used."
            },
            "openapi": {
              "type": "boolean",
              "description": "Whether an OpenAPI spec was used."
            },
            "manual_docs": {
              "type": "boolean",
              "description": "Whether manual documentation was used."
            }
          },
          "additionalProperties": false
        }
      },
      "additionalProperties": false
    },
    "lifecycle": {
      "type": "object",
      "description": "Optional release lifecycle metadata. Consumed by cmd/gen-registry when publishing a version to the registry; CLI flags override any value supplied here.",
      "properties": {
        "release_type": {
          "type": "string",
          "description": "Release stream for this version.",
          "enum": [
            "stable",
            "beta",
            "rc"
          ]
        },
        "maintenance_status": {
          "type": "string",
          "description": "Maintenance posture for this twin.",
          "enum": [
            "active",
            "security_only",
            "eol"
          ]
        },
        "maintenance_until": {
          "type": "string",
          "description": "Maintenance end date, ISO 8601 (YYYY-MM-DD).",
          "pattern": "^\\d{4}-\\d{2}-\\d{2}$"
        },
        "bsl_expiry_date": {
          "type": "string",
          "description": "BSL expiry date, ISO 8601 (YYYY-MM-DD). Commercial tier only.",
          "pattern": "^\\d{4}-\\d{2}-\\d{2}$"
        },
        "changelog": {
          "type": "string",
          "description": "Release notes for this version, as markdown. Rendered on /docs/twins/<vendor>/releases and used as the GitHub release body, and copied verbatim into the public registry entry, so it must not name internal or commercial-tier components.",
          "minLength": 1
        },
        "announcement_url": {
          "type": "string",
          "description": "Optional link to a longer-form /updates post for notable releases.",
          "format": "uri"
        },
        "breaking_changes": {
          "type": "array",
          "description": "Breaking changes introduced by this version.",
          "items": {
            "type": "string",
            "minLength": 1
          }
        }
      },
      "additionalProperties": false
    }
  },
  "additionalProperties": false
}
