{
  "display_name": "PostHog",
  "vendor_domain": "posthog.com",
  "tier": "community",
  "category": "analytics",
  "description": "Simulates the PostHog event capture, feature flag evaluation, identify, alias, group identify, exception tracking, and local evaluation API surfaces for the PostHog Go SDK.",
  "sdk_target": {
    "primary": {
      "package": "github.com/posthog/posthog-go",
      "language": "go",
      "version": "v0",
      "repo_url": "https://github.com/posthog/posthog-go",
      "docs_url": "https://posthog.com/docs/libraries/go"
    },
    "additional": []
  },
  "service_surface": {
    "openapi_spec": {
      "available": true,
      "origin": "vendor_published",
      "url": "https://posthog.com/docs/api"
    },
    "auth_pattern": "api_key",
    "has_webhooks": false,
    "resource_count": 8
  },
  "coverage": {
    "resources_implemented": [
      "capture",
      "decide",
      "identify",
      "alias",
      "group_identify",
      "flags",
      "local_evaluation",
      "exceptions"
    ],
    "resources_not_implemented": [
      "insights",
      "dashboards",
      "annotations",
      "experiments",
      "surveys",
      "cohorts"
    ],
    "estimated_coverage_pct": 85
  },
  "generation": {
    "method": "manual",
    "sources_used": {
      "deepwiki": false,
      "openapi": false,
      "manual_docs": true
    }
  },
  "publisher": "wondertwin",
  "vendor": "posthog",
  "twin_id": "twin-posthog",
  "vendor_certification": {
    "status": "none"
  }
}
