{
  "display_name": "Plaid",
  "vendor_domain": "plaid.com",
  "tier": "community",
  "category": "fintech",
  "description": "Scaffold of the Plaid app emulator: it launches as --port=N, answers GET /admin/health with {\"status\":\"ok\"}, and serves the shared admin plane (reset, state, config, quirks). Sandbox public token creation, public token exchange (Item and access token creation) and Item reads (item/get) are served; the remaining Plaid API routes arrive in later slices of build plan plaid-bp1.",
  "sdk_target": {
    "primary": {
      "package": "plaid-python",
      "language": "python",
      "version": "44.0.0",
      "repo_url": "https://github.com/plaid/plaid-python",
      "docs_url": "https://plaid.com/docs/api/"
    },
    "additional": [
      {
        "package": "plaid-node",
        "language": "typescript",
        "version": "47.0.0",
        "repo_url": "https://github.com/plaid/plaid-node"
      },
      {
        "package": "plaid-go",
        "language": "go",
        "version": "47.0.0",
        "repo_url": "https://github.com/plaid/plaid-go"
      }
    ]
  },
  "service_surface": {
    "openapi_spec": {
      "available": true,
      "origin": "vendor_published",
      "url": "https://github.com/plaid/plaid-openapi"
    },
    "auth_pattern": "custom",
    "has_webhooks": true,
    "resource_count": 3
  },
  "coverage": {
    "resources_implemented": [
      "sandbox/public_token/create",
      "item/public_token/exchange",
      "item/get"
    ],
    "resources_not_implemented": [
      "auth/get",
      "transactions/get",
      "transactions/refresh",
      "sandbox/transactions/create",
      "transactions/recurring/get",
      "transactions/sync",
      "institutions/get",
      "institutions/search",
      "institutions/get_by_id",
      "item/remove",
      "accounts/get",
      "sandbox/item/fire_webhook",
      "accounts/balance/get",
      "identity/get",
      "identity/match",
      "item/webhook/update",
      "item/access_token/invalidate",
      "webhook_verification_key/get",
      "sandbox/item/reset_login",
      "processor/token/create",
      "processor/stripe/bank_account_token/create",
      "link/token/create",
      "link/token/get"
    ]
  },
  "generation": {
    "method": "wondertwin_skill"
  },
  "publisher": "localstack",
  "vendor": "plaid",
  "twin_id": "twin-plaid",
  "vendor_certification": {
    "status": "none"
  }
}
