{
  "display_name": "Stripe",
  "vendor_domain": "stripe.com",
  "tier": "community",
  "category": "payments",
  "description": "Simulates the Stripe API /v1 on the dahlia release, served in the shape of 2026-08-26.dahlia: Customers, Products, Prices, PaymentIntents, PaymentMethods, Charges, Refunds, Subscriptions, Invoices, Coupons, SetupIntents, TaxRates, Disputes, Connect accounts, transfers, balance, payouts, events, checkout sessions, payment links, credit notes, promotion codes, subscription items, quotes, billing portal sessions, tokens, sources, mandates, confirmation tokens, application fees, application fee refunds, transfer reversals, account links, persons, topups, webhook endpoints, files, file links, shipping rates, reviews, and tax IDs, with signed webhook delivery. Accepts any dahlia Stripe-Version and refuses other releases with a 400. Array parameters are read in both the name[] and the indexed name[N] form the official SDKs send. Responses support expand (up to Stripe's documented four levels, including list expansion through data.), resolving any known object ID without checking Stripe's per-endpoint expandable-fields allowlist.",
  "vendor_api_version": "2026-08-26.dahlia",
  "sdk_target": {
    "primary": {
      "package": "github.com/stripe/stripe-go",
      "language": "go",
      "version": "v86",
      "api_version": "2026-08-26.dahlia",
      "repo_url": "https://github.com/stripe/stripe-go",
      "docs_url": "https://docs.stripe.com/api"
    },
    "additional": [
      {
        "package": "stripe",
        "language": "javascript",
        "version": "22.6.2",
        "repo_url": "https://github.com/stripe/stripe-node",
        "compatibility": "tested",
        "last_validated": "2026-09-28",
        "validation_method": "scenario_suite"
      },
      {
        "package": "stripe",
        "language": "python",
        "version": "15.6.1",
        "repo_url": "https://github.com/stripe/stripe-python",
        "compatibility": "tested",
        "last_validated": "2026-09-28",
        "validation_method": "scenario_suite"
      }
    ]
  },
  "service_surface": {
    "openapi_spec": {
      "available": true,
      "origin": "vendor_published",
      "url": "https://raw.githubusercontent.com/stripe/openapi/v2524/latest/openapi.spec3.json"
    },
    "auth_pattern": "api_key",
    "has_webhooks": true,
    "resource_count": 44
  },
  "coverage": {
    "resources_implemented": [
      "customers",
      "products",
      "prices",
      "payment_intents",
      "payment_methods",
      "charges",
      "refunds",
      "subscriptions",
      "invoices",
      "invoice_items",
      "coupons",
      "setup_intents",
      "tax_rates",
      "disputes",
      "accounts",
      "external_accounts",
      "transfers",
      "balance",
      "payouts",
      "balance_transactions",
      "events",
      "checkout_sessions",
      "payment_links",
      "credit_notes",
      "promotion_codes",
      "subscription_items",
      "quotes",
      "billing_portal_sessions",
      "tokens",
      "sources",
      "mandates",
      "confirmation_tokens",
      "application_fees",
      "application_fee_refunds",
      "transfer_reversals",
      "account_links",
      "persons",
      "topups",
      "webhook_endpoints",
      "files",
      "file_links",
      "shipping_rates",
      "reviews",
      "tax_ids"
    ],
    "resources_not_implemented": [
      "issuing_cardholders",
      "issuing_cards",
      "issuing_authorizations",
      "issuing_transactions",
      "issuing_disputes",
      "terminal_readers",
      "terminal_locations",
      "terminal_configurations",
      "terminal_connection_tokens",
      "treasury_financial_accounts",
      "treasury_outbound_payments",
      "treasury_outbound_transfers",
      "treasury_received_credits",
      "treasury_received_debits",
      "treasury_transactions",
      "radar_value_lists",
      "radar_value_list_items",
      "radar_early_fraud_warnings",
      "identity_verification_sessions",
      "identity_verification_reports",
      "financial_connections_accounts",
      "financial_connections_sessions",
      "financial_connections_transactions",
      "tax_calculations",
      "tax_transactions",
      "tax_registrations",
      "tax_settings",
      "climate_orders",
      "climate_products",
      "climate_suppliers",
      "sigma_scheduled_query_runs",
      "reporting_report_runs",
      "reporting_report_types",
      "forwarding_requests"
    ]
  },
  "generation": {
    "method": "manual",
    "sources_used": {
      "deepwiki": false,
      "openapi": false,
      "manual_docs": true
    }
  },
  "publisher": "localstack",
  "vendor": "stripe",
  "twin_id": "twin-stripe",
  "vendor_certification": {
    "status": "none"
  },
  "lifecycle": {
    "release_type": "stable",
    "maintenance_status": "active",
    "changelog": "The Stripe app emulator now targets the Stripe API on the dahlia release, served in the shape of `2026-08-26.dahlia`, and works with the official SDKs stripe-go v86, stripe-node v22 and stripe-python v15.\n\n### Changed\n- `Stripe-Version`: any dahlia version is accepted; other releases, `.preview` and `/v2` are refused. The account default is `STRIPE_API_VERSION`, default `2026-08-26.dahlia`\n- Events are labelled with a dahlia version instead of `2024-04-10`; each webhook endpoint receives events labelled with its own `api_version`\n- Webhooks are delivered as signed Stripe event objects to every registered endpoint, without needing `--webhook-url`\n- Lists are newest first, with `ending_before`; filters apply before paging\n- Subscriptions and invoices carry dahlia `discounts` (IDs, expandable) instead of the removed `discount`\n- Object IDs are opaque and Stripe-shaped instead of sequential\n- Errors carry `param` and `doc_url`; an unknown key is refused with 401; an unknown path is a JSON 404\n- Unknown parameters, non-integer values for integer parameters, negative amounts and a `limit` outside 1 to 100 are refused with Stripe's `invalid_request_error`\n- Metadata updates merge key by key: an empty value removes a key, `metadata=` clears them all, and Stripe's limits apply (50 keys, 40-character keys, 500-character values)\n- Retrieving a deleted customer returns Stripe's deleted object instead of a 404\n\n### Fixed\n- Fields Stripe returns as `null` were left out of responses, so reading them (for example `customer.email`) failed in stripe-python\n- Indexed array parameters (`expand[0]`, `enabled_events[0]`) sent by every official SDK were ignored\n- Documented decline test payment methods (`pm_card_visa_chargeDeclined` and family) now decline as documented\n- Reusing an idempotency key with different parameters returns `idempotency_error`\n- Checkout Sessions accept `price_data`, and `line_items` is an includable list with its own list route\n- Expansions deeper than four levels are refused\n\n### Removed\n- The self-declared `estimated_coverage_pct`\n\n### Verified\n- Official SDKs stripe-node 22.6.2 and stripe-python 15.6.1: 36 of 36 scenario cases against the app emulator\n- Community adversarial audit: passed after its four critical and high findings were fixed\n- Through LocalStack: not run\n- Live comparison with Stripe: not run\n\n### Not modelled\n- Many routes beyond the core payments and billing flows, including updates to refunds, payment methods, checkout sessions and coupons, charge capture, invoice line listing and every `/search` route. Every deliberate difference from Stripe is listed in twin-stripe/divergences.json\n\n### Known issues\n- Some fields Stripe always returns are missing, for example a subscription's `currency`, `start_date` and `billing_cycle_anchor`, and an invoice's `attempted`, `attempt_count` and `auto_advance`\n- A few routes still take parameters dahlia removed: `coupon` on promotion codes, `currency` on credit notes and quotes, and `amount_total` on quotes and Checkout Sessions\n- `GET /v1/customers/search` answers `No such customer: 'search'` instead of reporting an unknown route\n- Responses carry no `Request-Id` header, so the SDKs report no request id\n- An unknown `/v1` path without an API key returns 401, where Stripe returns 404\n- The `customer.deleted` event carries only the customer's `id`\n- Error messages follow Stripe's error codes, but their wording is not confirmed against Stripe"
  }
}
